title,price,availability,rating
A Light in the Attic,£51.77,In stock,Three
In Her Wake,£12.84,In stock,One
Slow States of Collapse: Poems,£57.31,In stock,Three
The Nameless City (The Nameless City #1),£38.16,In stock,Four
"Princess Jellyfish 2-in-1 Omnibus, Vol. 01 (Princess Jellyfish 2-in-1 Omnibus #1)",£13.61,In stock,Five
Immunity: How Elie Metchnikoff Changed the Course of Modern Medicine,£57.36,In stock,Five
Algorithms to Live By: The Computer Science of Human Decisions,£30.81,In stock,One
The Shadow Hero (The Shadow Hero),£33.14,In stock,One
The Bridge to Consciousness: I'm Writing the Bridge Between Science and Our Old and New Beliefs.,£32.00,In stock,Three
Modern Romance,£28.26,In stock,Five
Dark Notes,£19.19,In stock,Five
Whole Lotta Creativity Going On: 60 Fun and Unusual Exercises to Awaken and Strengthen Your Creativity,£38.20,In stock,Four
The Power of Habit: Why We Do What We Do in Life and Business,£16.88,In stock,Three
Swell: A Year of Waves,£45.58,In stock,One
My Name Is Lucy Barton,£41.56,In stock,One
Hold Your Breath (Search and Rescue #1),£28.82,In stock,One
Code Name Verity (Code Name Verity #1),£22.13,In stock,Four
All the Light We Cannot See,£29.87,In stock,Five
The Midnight Watch: A Novel of the Titanic and the Californian,£26.20,In stock,One
Hide Away (Eve Duncan #20),£11.84,In stock,One
Mothering Sunday,£13.34,In stock,Two
Without Shame,£48.27,In stock,Five
Chernobyl 01:23:40: The Incredible True Story of the World's Worst Nuclear Disaster,£35.92,In stock,Two
Roller Girl,£14.10,In stock,Five
Heaven is for Real: A Little Boy's Astounding Story of His Trip to Heaven and Back,£52.86,In stock,Two
The Story of Art,£41.14,In stock,Four
Nightstruck: A Novel,£50.35,In stock,Four
Benjamin Franklin: An American Life,£48.19,In stock,Three
The Barefoot Contessa Cookbook,£59.92,In stock,Five
World Without End (The Pillars of the Earth #2),£32.97,In stock,Four
The Dream Thieves (The Raven Cycle #2),£34.50,In stock,One
Isla and the Happily Ever After (Anna and the French Kiss #3),£48.13,In stock,Five
Alight (The Generations Trilogy #2),£58.59,In stock,Four
Shopaholic Ties the Knot (Shopaholic #3),£48.39,In stock,Five
Far From True (Promise Falls Trilogy #2),£34.93,In stock,Two
Walk the Edge (Thunder Road #2),£32.36,In stock,Three
The Silkworm (Cormoran Strike #2),£23.05,In stock,Five
The Lean Startup: How Today's Entrepreneurs Use Continuous Innovation to Create Radically Successful Businesses,£33.92,In stock,Three
The Da Vinci Code (Robert Langdon #2),£22.96,In stock,Two
Seven Days in the Art World,£52.33,In stock,Two
Notes from a Small Island (Notes From a Small Island #1),£40.17,In stock,One
Jurassic Park (Jurassic Park #1),£44.97,In stock,One
Girl in the Blue Coat,£46.83,In stock,Two
Civilization and Its Discontents,£59.95,In stock,Two
Annie on My Mind,£36.83,In stock,Five
"Fruits Basket, Vol. 2 (Fruits Basket #2)",£11.64,In stock,Five
The Secret Healer,£34.56,In stock,Three
The Bhagavad Gita,£57.49,In stock,Three
On the Road (Duluoz Legend),£32.36,In stock,Three
Frankenstein,£38.00,In stock,Two
Forever Rockers (The Rocker #12),£28.80,In stock,Three
Fighting Fate (Fighting #6),£39.24,In stock,Three
Emma,£32.93,In stock,Two
"Eat, Pray, Love",£51.32,In stock,Three
Deep Under (Walker Security #1),£47.09,In stock,Five
Choosing Our Religion: The Spiritual Lives of America's Nones,£28.42,In stock,Four
Charlie and the Chocolate Factory (Charlie Bucket #1),£22.85,In stock,Three
Charity's Cross (Charles Towne Belles #4),£41.24,In stock,One
Bright Lines,£39.07,In stock,Five
Bridget Jones's Diary (Bridget Jones #1),£29.82,In stock,One
Bounty (Colorado Mountain #7),£37.26,In stock,Four
Blood Defense (Samantha Brinkman #1),£20.30,In stock,Three
"Bleach, Vol. 1: Strawberry and the Soul Reapers (Bleach #1)",£34.65,In stock,Five
Beyond Good and Evil,£43.38,In stock,One
Alice in Wonderland (Alice's Adventures in Wonderland #1),£55.53,In stock,One
"Ajin: Demi-Human, Volume 1 (Ajin: Demi-Human #1)",£57.06,In stock,Four
A Spy's Devotion (The Regency Spies of London #1),£16.97,In stock,Five
1st to Die (Women's Murder Club #1),£53.98,In stock,One
"1,000 Places to See Before You Die",£26.08,In stock,Five
The Most Perfect Thing: Inside (and Outside) a Bird's Egg,£42.96,In stock,Four
Immunity: How Elie Metchnikoff Changed the Course of Modern Medicine,£57.36,In stock,Five
Sorting the Beef from the Bull: The Science of Food Fraud Forensics,£44.74,In stock,Four
Tipping Point for Planet Earth: How Close Are We to the Edge?,£37.55,In stock,One
"The Fabric of the Cosmos: Space, Time, and the Texture of Reality",£55.91,In stock,One
Diary of a Citizen Scientist: Chasing Tiger Beetles and Other New Ways of Engaging the World,£28.41,In stock,One
The Origin of Species,£10.01,In stock,Four
The Grand Design,£13.76,In stock,Three
Peak: Secrets from the New Science of Expertise,£16.28,In stock,Two
"The Elegant Universe: Superstrings, Hidden Dimensions, and the Quest for the Ultimate Theory",£13.03,In stock,Four
"The Disappearing Spoon: And Other True Tales of Madness, Love, and the History of the World from the Periodic Table of the Elements",£57.35,In stock,Five
"Surely You're Joking, Mr. Feynman!: Adventures of a Curious Character",£25.83,In stock,Two
Seven Brief Lessons on Physics,£30.60,In stock,Four
The Selfish Gene,£29.45,In stock,One
